{
  "$schema": "https://agent-project-os.org/schemas/agent-release-v1.schema.json",
  "activated_at": "2026-08-18T00:00:00Z",
  "agent_id": "agent:service-pm",
  "approved_by": "agent:hr-approver",
  "asset": {
    "commit": "synthetic-v2",
    "path": "agent-assets/service-pm-v2.md",
    "sha256": "092c708599ed9f29b76aa165f920840e142b98787b7c35f4a4d3683ff7d8979f"
  },
  "created_at": "2026-08-18T00:00:00Z",
  "protocol_version": "1.0",
  "release_id": "service-pm-v2",
  "rollback_release_id": "service-pm-v1",
  "status": "active"
}
